{
  "aggregation": "separate_repository_type_scores_no_raw_sum",
  "benchmark_id": "cockpit-benchmark",
  "default_suite": "all",
  "integration_status": "published",
  "legacy_baseline": {
    "path": "suites/legacy-v094.json",
    "sha256": "a1944ba5d6d8a5a5d58d1f3d7b270b26150cda56a165d12c3c9737df754cae5b"
  },
  "schema_version": "benchmark-repository-types-2",
  "suites": [
    {
      "canonical_scores": {
        "path": "suites/app/STANDARD_SCORES.json",
        "sha256": "f9ef83d2e95632ad1ae3c7eef369b93a152fe1bd55fe6daef854e80d49e0cbe3"
      },
      "contract": {
        "path": "SCORE_RULES.md",
        "sha256": "2bb21ed67c9e47c3cf7691bc2a526fa3e2c41b410017fa4faa41a02132da7b91"
      },
      "failed_leaves": 0,
      "id": "app",
      "leaf_count": 88,
      "manifest": {
        "path": "suites/app/manifest.json",
        "sha256": "bac5e0da66faf6207aee44179ebab41f6a0bc7279e517f5acb6ecfc5f86cf361"
      },
      "max_score": 440,
      "name": "APP",
      "published_repositories": 11,
      "repository_count": 11,
      "score": 142,
      "status": "published",
      "technology": "Android"
    },
    {
      "canonical_scores": {
        "path": "suites/fw/STANDARD_SCORES.json",
        "sha256": "4c5a7a6cf7ebcbcc93c901caf3709cddc14571c08ae14f4aa4c929321a48624b"
      },
      "contract": {
        "path": "SCORE_RULES.md",
        "sha256": "2bb21ed67c9e47c3cf7691bc2a526fa3e2c41b410017fa4faa41a02132da7b91"
      },
      "failed_leaves": 0,
      "id": "fw",
      "leaf_count": 121,
      "manifest": {
        "path": "suites/fw/manifest.json",
        "sha256": "f36682b7f2ae29d45677ed95b2c529c54993dd87aadf27c530a6cf433709fb2c"
      },
      "max_score": 572,
      "name": "FW",
      "published_repositories": 11,
      "repository_count": 11,
      "score": 194,
      "status": "published",
      "technology": "Android"
    },
    {
      "canonical_scores": {
        "path": "suites/new-energy-matlab/cohorts/reality-proxy-20260910/STANDARD_SCORES.json",
        "sha256": "66a4b83ea43afa962ce7cf3a28451440ab8b391cdbfefe0010094fe1600c3a2c"
      },
      "cohorts": {
        "path": "suites/new-energy-matlab/cohorts.json",
        "sha256": "4371e0021ed3e7d522bd8a61ef35a9ca648ed82288075d101063c0b11bc7e6ff"
      },
      "contract": {
        "path": "suites/new-energy-matlab/cohorts/reality-proxy-20260910/contract-index.json",
        "sha256": "0e520a2a41904649c545164fdc8d37abff0588b6c5aa943e9f863c22525b389d"
      },
      "failed_leaves": 0,
      "id": "new-energy-matlab",
      "leaf_count": 143,
      "manifest": {
        "path": "suites/new-energy-matlab/cohorts/reality-proxy-20260910/manifest.json",
        "sha256": "a411922a2a0402164ca4037c4e7c495ca48bbf3abd6cdb49417d17f9e288d374"
      },
      "max_score": 671,
      "name": "New Energy MATLAB",
      "published_repositories": 11,
      "repository_count": 11,
      "score": 409,
      "status": "published",
      "technology": "MATLAB / Simulink"
    }
  ]
}
